name,link,date_added
Push Press,https://www.youtube.com/watch?v=HiuwF0Pc5pc,2024-08-08 17:20:56
Dual DB Thruster,https://www.youtube.com/watch?v=C7yzsR3GcaI,2024-08-08 17:20:56
Walking Lunges (Caminhada com passadas),https://www.youtube.com/watch?v=QHo-bGE1tFM,2024-08-08 17:20:56
Single Hip Lift Hold (Elevacao pelvica unilateral em Isometria),https://www.youtube.com/watch?v=-me0NuLtZaQ,2024-08-08 17:20:56
Reverse Lunges (Passadas Reversas),https://www.youtube.com/watch?v=5ubld5_L-04,2024-08-08 17:20:56
Quadruped Controlled Articular Rotations (Rotacao de braco em quatro apoios),https://www.youtube.com/watch?v=PrMKb7TInto,2024-08-08 17:20:56
Plank Toe Taps (Prancha com toques nos pes alternados),https://www.youtube.com/watch?v=e8ffJSbS6tc,2024-08-08 17:20:56
Monster Walking Banded (Deslocamento frontal e costas com miniband),https://www.youtube.com/watch?v=YN3wmrPVP_k,2024-08-08 17:20:56
Kettlebell Reverse Lunge To Romanian Deadlift (Passada reversa com deadlift unilateral),https://www.youtube.com/watch?v=79SVEfkR128,2024-08-08 17:20:56
Hip Rotation 90/90 to Pigeon Stretch (Rotacao de quadril 90/90 com alongamento do pombo),https://www.youtube.com/watch?v=fASdWDluHrc,2024-08-08 17:20:56
Goblet Cossack Squat (Agachamento unilateral segurando kettlebell),https://www.youtube.com/watch?v=X83Z5Az8IIw,2024-08-08 17:20:56
Forearm to Tall Plank (Alternando prancha baixa para alta),https://www.youtube.com/watch?v=ocWx5_GRa1g,2024-08-08 17:20:56
Forearm Plank Single Leg (Prancha baixa com uma perna),https://www.youtube.com/watch?v=AJcYCrj5fHw,2024-08-08 17:20:56
Forearm Plank Alternating Row (Prancha baixa com remadas alternadas),https://www.youtube.com/watch?v=7vrnYlI4Mss,2024-08-08 17:20:56
Dual KB Sumo Deadlift High Pull (Deadlift sumo com remada alta com dois kettlebells),https://www.youtube.com/watch?v=dH5RDFc1JYk,2024-08-08 17:20:56
Double Push Up Burpee (Burpees com duas flexoes de braco),https://www.youtube.com/watch?v=Ku3nSg6U38c,2024-08-08 17:20:56
Bench Elbow Mobility (Mobilidade Ombros Bracos 90),https://www.youtube.com/watch?v=1krICxmiWNQ,2024-08-08 17:20:56
Alternating Dumbbell Plank Rows (Prancha alta com remadas alternadas de halteres),https://www.youtube.com/watch?v=cDW2SKnmch4,2024-08-08 17:20:56
Depoimento 07- Alta Personal,https://www.youtube.com/watch?v=WB8IxNPm6bY,2024-08-08 17:20:56
Star Push up (Flexao de braco estrela),https://www.youtube.com/watch?v=0H72eG-lVLw,2024-08-08 17:20:56
Single KB Clean,https://www.youtube.com/watch?v=3FFBaR394qk,2024-08-08 17:20:56
Toe Touch Progression (Progressoes de toques nos pes),https://www.youtube.com/watch?v=Y6FoOllZAZQ,2024-08-08 17:20:56
Press Out Squat (Agachamento com desenvolvimento a frente),https://www.youtube.com/watch?v=HCygih7eWhM,2024-08-08 17:20:56
Leg Press Machine,https://www.youtube.com/watch?v=7WS1BmmHPgA,2024-08-08 17:20:56
Goblet Bulgarian Squat (Agachamento búlgaro segurando o kettlebell),https://www.youtube.com/watch?v=Te2VCd9-D-w,2024-08-08 17:20:56
Goblet Box Step Down (Descida da caixa segurando o kettlebell),https://www.youtube.com/watch?v=zz27D-lmVew,2024-08-08 17:20:56
Front Lunges (Passadas com carga a frente),https://www.youtube.com/watch?v=9k9Ty-AsnjQ,2024-08-08 17:20:56
Calf Leg Press (Panturrilha no leg press),https://www.youtube.com/watch?v=x9MIhGvLBQA,2024-08-08 17:20:56
Kettlebell Windmill (Catavendo com Kettlebell),https://www.youtube.com/watch?v=q1n-z_NcsoI,2024-08-08 17:20:56
Kettlebell Halo (Rotacao de bracos em volta da cabeca com kettlebell),https://www.youtube.com/watch?v=5TI7CTxHU5A,2024-08-08 17:20:56
Hip Thrust (Elevacao Pelvica),https://www.youtube.com/watch?v=NVBeLvQBHhA,2024-08-08 17:20:56
1/2 Kneeling PVC Rotation (Rotacao toracica com PVC semi ajoelhado),https://www.youtube.com/watch?v=9rnFhk5gBho,2024-08-08 17:20:56
Single Delt Fly (Deltoide Unilateral na polia),https://www.youtube.com/watch?v=Bz5deNO1Qtg,2024-08-08 17:20:56
Single Bench Press (Supino Unilateral),https://www.youtube.com/watch?v=L58omSp6k1g,2024-08-08 17:20:56
DB Single Press (Desenvolvimento militar unilateral com DB),https://www.youtube.com/watch?v=VmdaczmVc70,2024-08-08 17:20:56
Chest Fly (Crucifixo),https://www.youtube.com/watch?v=UxzipdcVCR4,2024-08-08 17:20:56
Crossover Chest Fly (Peitoral voador no crossover),https://www.youtube.com/watch?v=CL90W3j3zlE,2024-08-08 17:20:56
Chest Fly Machine (Peitoral Voador),https://www.youtube.com/watch?v=j1EMgEd6aHE,2024-08-08 17:20:56
Wide Grip Lat Pulldown  (Puxada alta com pegada aberta),https://www.youtube.com/watch?v=-CC8FY51G8U,2024-08-08 17:20:56
Upright KB Row (Remada alta com kettlebell),https://www.youtube.com/watch?v=ke4YPMntek0,2024-08-08 17:20:56
Upright Pulley Row (Remada alta na polia ou peso livre),https://www.youtube.com/watch?v=xRjkO4ycO3c,2024-08-08 17:20:56
Upright Rope Row (Remada alta com corda),https://www.youtube.com/watch?v=hpALsnAKCOA,2024-08-08 17:20:56
Rope Pulldown (Puxada alta com corda),https://www.youtube.com/watch?v=i8PN_D6bTn4,2024-08-08 17:20:56
Rope Bicep Curls (Rosca Biceps com corda),https://www.youtube.com/watch?v=F50A2FsCjEo,2024-08-08 17:20:56
Reverse Fly Machine (Dorsal Voador),https://www.youtube.com/watch?v=DA_LGFYdlb4,2024-08-08 17:20:56
Rope Face Pull (Puxada a face com corda),https://www.youtube.com/watch?v=Jc1G7IOjTyM,2024-08-08 17:20:56
Dual KB Row (Remada com dois kettlebell),https://www.youtube.com/watch?v=gyiEzOdu6AI,2024-08-08 17:20:56
Single Leg RDL (Deadlift Romeno unilateral),https://www.youtube.com/watch?v=ToysWg0ha5s,2024-08-08 17:20:56
Dual KB Stiff (Sfiff com dois kettlebell),https://www.youtube.com/watch?v=j0maD0ykrjQ,2024-08-08 17:20:56
Barbell Hip Thrust (Elevacao Pelvica com barra),https://www.youtube.com/watch?v=ZbA9NdOp9wQ,2024-08-08 17:20:56
Adduction Chair (Cadeira Adutora),https://www.youtube.com/watch?v=faYVG6hD5Mg,2024-08-08 17:20:56
Rotator Cuff External Rotation (Manguito Externo),https://www.youtube.com/watch?v=S0MZqPB6wGs,2024-08-08 17:20:56
Rope Triceps Extension (Extensao de Triceps com corda),https://www.youtube.com/watch?v=OU-QKT5tPkM,2024-08-08 17:20:56
Leg Flexor Chair (Cadeira Flexora),https://www.youtube.com/watch?v=4CzCWxkrnwY,2024-08-08 17:20:56
Leg Extension Chair (Cadeira Extensora),https://www.youtube.com/watch?v=73CIyllybQ4,2024-08-08 17:20:56
Lateral Raise (Elevacao Lateral),https://www.youtube.com/watch?v=IqrMhqqExds,2024-08-08 17:20:56
Close Grip Row (Remada baixa com pegada fechada),https://www.youtube.com/watch?v=er_alEbery0,2024-08-08 17:20:56
Abduction Chair (Cadeira Abdutora),https://www.youtube.com/watch?v=dQB_EVK27CQ,2024-08-08 17:20:56
Barbell Push Press,https://www.youtube.com/watch?v=xKpqPJR9e4w,2024-08-08 17:20:56
Deadlift (Levantamento Terra),https://www.youtube.com/watch?v=lH1vhk0C28k,2024-08-08 17:20:56
Romanian Deadlift (Levantamento terra romeno  sem tocar o chao),https://www.youtube.com/watch?v=ahl02j0w20Q,2024-08-08 17:20:56
Air Plane (Aviao),https://www.youtube.com/watch?v=WuZxUBImUoE,2024-08-08 17:20:56
CAT CAMEL (Gato e Camelo),https://www.youtube.com/watch?v=C1GcieI2eJg,2024-08-08 17:20:56
Cossack Squat Hold (Isometria em agachamento unilateral),https://www.youtube.com/watch?v=zRTlxUhQNDU,2024-08-08 17:20:56
Deadbug Bench Legs (Deadbug no banco),https://www.youtube.com/watch?v=GJaaEaVsM28,2024-08-08 17:20:56
Banded Leg Lower (Descida de perna estendida com auxilio de elastico),https://www.youtube.com/watch?v=xu8JqaTynes,2024-08-08 17:20:56
Botton Up (Desenvolvimento com estabilizacao de Kettlebell),https://www.youtube.com/watch?v=pMkLpdD8ykI,2024-08-08 17:20:56
Box Mobility (Mobilidade de ombros na caixa),https://www.youtube.com/watch?v=KpMmJzz5qxk,2024-08-08 17:20:56
Fire Hidrant Hip Abduction (Abducao de quadril com miniband em quadro apoios),https://www.youtube.com/watch?v=8jP5V5nDs4I,2024-08-08 17:20:56
Prone PVC Press (Pronado com desenvolvimento com PVC),https://www.youtube.com/watch?v=CjcvJK93UwA,2024-08-08 17:20:56
Prone W Lift (Pronado com elevacao de bracos em W),https://www.youtube.com/watch?v=2W2PuF35kk0,2024-08-08 17:20:56
Prone Y W T (Pronado com elevacao de bracos em Y W T),https://www.youtube.com/watch?v=Unw3bqdMKww,2024-08-08 17:20:56
Side Walking Banded (Deslocamento lateral com Miniband),https://www.youtube.com/watch?v=JPL2NbsjiyQ,2024-08-08 17:20:56
Single Hip Lift (Elevacao Pelvica Unilateral),https://www.youtube.com/watch?v=SQP0_CNCYbA,2024-08-08 17:20:56
Quadruped Hip Cars (Rotacao de perna em circulo em quatro apoios),https://www.youtube.com/watch?v=N0aD3abu4UI,2024-08-08 17:20:56
Quadruped Scapular Push Ups (Flexao de escapula em quatro apoios),https://www.youtube.com/watch?v=oTOLdcVUIYw,2024-08-08 17:20:56
Hip Mobility Elbow To Floor (Mobidade de quadril tocando cotovelo no chao),https://www.youtube.com/watch?v=czFTrdo8XhQ,2024-08-08 17:20:56
Thread The Needle (Rotacao toracica três apoios com cotovelos no chao e extensao total),https://www.youtube.com/watch?v=XxoquAapCXk,2024-08-08 17:20:56
Leg Lower (Descida de perna unilateral mantendo ambas estendidas),https://www.youtube.com/watch?v=YIG7ErwVfGM,2024-08-08 17:20:56
Hip Rotation 90/90 (Rotacao de quadril 90/90),https://www.youtube.com/watch?v=duXHK8viiuo,2024-08-08 17:20:56
Running (Corrida),https://www.youtube.com/watch?v=OlbH8PiJFg0,2024-08-08 17:20:56
High Heel (Calcanhar Alto),https://www.youtube.com/watch?v=UHO-oz1J1tg,2024-08-08 17:20:56
High Knees (Joelho Alto),https://www.youtube.com/watch?v=TxepMIXIA4E,2024-08-08 17:20:56
Jumping Jacks (Polichinelos),https://www.youtube.com/watch?v=ZMaeooWF1X0,2024-08-08 17:20:56
Single Unders (Saltos simples de corda),https://www.youtube.com/watch?v=hvK94jv_--U,2024-08-08 17:20:56
Ground Jumps (Toques no chao com saltos),https://www.youtube.com/watch?v=QCSAxVc-Iok,2024-08-08 17:20:56
Ground to Over Head (Levantamento do chao para acima da cabeca),https://www.youtube.com/watch?v=kmVeOuDcFyE,2024-08-08 17:20:56
Dumbell Snatch (Snatch com Halter),https://www.youtube.com/watch?v=u9LUoUvE6Uo,2024-08-08 17:20:56
American Kettlebell Swing (Balanco com Kettlebell ate o topo da cabeca),https://www.youtube.com/watch?v=GcpvXCa6PAQ,2024-08-08 17:20:56
Sprawl,https://www.youtube.com/watch?v=XMZAtTVkmq8,2024-08-08 17:20:56
Burpees,https://www.youtube.com/watch?v=OwgB7QUPK3A,2024-08-08 17:20:56
Burpees Over Bar (Burpees saltando a barra),https://www.youtube.com/watch?v=MVR1zs36k80,2024-08-08 17:20:56
Burpees Box Jump over (Burpees com saltos na caixa passando por cima),https://www.youtube.com/watch?v=4JVpM9jl6eY,2024-08-08 17:20:56
Inchworm No Push Up (Minhoca sem Flexao),https://www.youtube.com/watch?v=Z2tDwWLtQEI,2024-08-08 17:20:56
Frankeistein (Elevacao de pernas estendidas de forma alternadas),https://www.youtube.com/watch?v=1-S2i43FuIw,2024-08-08 17:20:56
Good Morning (Bom dia),https://www.youtube.com/watch?v=9HL2HkiPqzc,2024-08-08 17:20:56
Russian Kettlebell Swing (Balanco de kettlebell russo),https://www.youtube.com/watch?v=7DfB-I-9FR8,2024-08-08 17:20:56
Jump Squat (Agachamento com saltos),https://www.youtube.com/watch?v=Ka6sNUpD1S0,2024-08-08 17:20:56
Thruster (Agachamento frontal com desenvolvimento),https://www.youtube.com/watch?v=2z73yMgTwsM,2024-08-08 17:20:56
Goblet Box Step Over (Passada sobre a caixa segurando peso),https://www.youtube.com/watch?v=VRHIpMzPo60,2024-08-08 17:20:56
Jumping Lunges (Passadas com salto),https://www.youtube.com/watch?v=MJvgJTtJwIU,2024-08-08 17:20:56
Goblet Jump Lunges (Afundo com saltos segurando peso),https://www.youtube.com/watch?v=p3Wlqjrma6c,2024-08-08 17:20:56
Box Jumps (Saltos na caixa),https://www.youtube.com/watch?v=oUkGXlgICDE,2024-08-08 17:20:56
Box Jumps Over (Saltos na caixa passando por cima),https://www.youtube.com/watch?v=DDfE7ZgJyeQ,2024-08-08 17:20:56
KB Deadlift (Deadlift com Ketllebell),https://www.youtube.com/watch?v=9VEIMXaXLF8,2024-08-08 17:20:56
Goblet Squat (Agachamento segurando kettlebell),https://www.youtube.com/watch?v=1vKdgdlwuSc,2024-08-08 17:20:56
Half TGU (Meio Turkish Get Up),https://www.youtube.com/watch?v=hhVlEf7u9Zg,2024-08-08 17:20:56
KB Dead Clean,https://www.youtube.com/watch?v=_Fj-ok4oEJk,2024-08-08 17:20:56
KB Dead Swing,https://www.youtube.com/watch?v=eRVV48cg29w,2024-08-08 17:20:56
KB Pêndulo Swing,https://www.youtube.com/watch?v=KgSvQU8BJ2s,2024-08-08 17:20:56
KB Swing (Balanco russo com kettlebell),https://www.youtube.com/watch?v=zSARjOWFqVU,2024-08-08 17:20:56
KB One Arm Swing,https://www.youtube.com/watch?v=TXfB_912-Xs,2024-08-08 17:20:56
Dual KB Clean,https://www.youtube.com/watch?v=nN66M-qgmWE,2024-08-08 17:20:56
KB Half Snatch,https://www.youtube.com/watch?v=2HOhf_1YQqY,2024-08-08 17:20:56
KB Snatch,https://www.youtube.com/watch?v=euaHjcF6s3E,2024-08-08 17:20:56
TGU Turkish Get Up (Levantamento Turco),https://www.youtube.com/watch?v=v0nnG-TAlh0,2024-08-08 17:20:56
Single KB Push Jerk,https://www.youtube.com/watch?v=2h1t_aFMeYo,2024-08-08 17:20:56
Dual KB Push Jerk,https://www.youtube.com/watch?v=qdUi7HX_Hps,2024-08-08 17:20:56
Dual KB Clean & Jerk,https://www.youtube.com/watch?v=P_6bTOFrmNg,2024-08-08 17:20:56
Single Deadlift (Levantamento terra unilateral),https://www.youtube.com/watch?v=3hHDYu3rOks,2024-08-08 17:20:56
Single Deadlift Dual Kettlebell (Levantamento terra unilateral),https://www.youtube.com/watch?v=Rmb3qsl0bJE,2024-08-08 17:20:56
Romanian Deadlift (Levantamento terra romeno  sem tocar o chao),https://www.youtube.com/watch?v=c7licov8B-Y,2024-08-08 17:20:56
Sumo Deadlift (Levantamento terra com base sumo),https://www.youtube.com/watch?v=qiwyF1KzJAM,2024-08-08 17:20:56
Deadlift (Levantamento Terra),https://www.youtube.com/watch?v=n8AjkCUEut0,2024-08-08 17:20:56
Stiff,https://www.youtube.com/watch?v=MpXWUvqvTnI,2024-08-08 17:20:56
Hip Lift (Elevacao de Pelvica Quadril),https://www.youtube.com/watch?v=RojqBNy67pw,2024-08-08 17:20:56
Single Hip Lift (Elevacao pelvica unilateral),https://www.youtube.com/watch?v=eVAx6MnHj_8,2024-08-08 17:20:56
Bench Hip Lift (Elevacao pelvica no banco),https://www.youtube.com/watch?v=LM7lHQRXkX8,2024-08-08 17:20:56
Three Point Kettlebell Row (Remada Curvada com 3 apoios),https://www.youtube.com/watch?v=OI9PhLc5iq8,2024-08-08 17:20:56
Gorila Row (Remadas alternadas com kettlebell no solo),https://www.youtube.com/watch?v=NRRgjP_oeqw,2024-08-08 17:20:56
Gorilla Row Top Down (Remada de gorila segurando no alto),https://www.youtube.com/watch?v=ALqc9bEuccU,2024-08-08 17:20:56
Split Stance Single Arm KB Row (Remada unilateral com base tesoura),https://www.youtube.com/watch?v=zVj5J5oSqts,2024-08-08 17:20:56
Kettlebell Row (Remada com Kettlebell),https://www.youtube.com/watch?v=Z7RzNGPQQ1c,2024-08-08 17:20:56
Barbell Row (Remada com barra),https://www.youtube.com/watch?v=D3eoBFh2f64,2024-08-08 17:20:56
Pullover (Puxada para cima deitado),https://www.youtube.com/watch?v=oLGc9gzk8aU,2024-08-08 17:20:56
Hammer Bicep Curls (Biceps Martelo),https://www.youtube.com/watch?v=Mlw44Z_MHqo,2024-08-08 17:20:56
KB Preacher Curl (Rosca biceps sentado com cotovelos entre joelhos),https://www.youtube.com/watch?v=LuBF-Wn2hD0,2024-08-08 17:20:56
Reverse Fly (Elevacao Lateral Curvada),https://www.youtube.com/watch?v=J2y1epbW87g,2024-08-08 17:20:56
Split Squat (Agachamento afundo),https://www.youtube.com/watch?v=aujlbb8e0hg,2024-08-08 17:20:56
Cossack Squat (Agachamento unilateral),https://www.youtube.com/watch?v=8XYQUEuirfI,2024-08-08 17:20:56
Goblet Split Squat (Afundo segurando kettlebell),https://www.youtube.com/watch?v=8KF1XEyrSfw,2024-08-08 17:20:56
Suitcase Split Squat (Afundo segurando um kettlebell ao lado),https://www.youtube.com/watch?v=iHnrwckbLRs,2024-08-08 17:20:56
Farmer Split Squat (Afundo segurando dois kettlebells ao lado),https://www.youtube.com/watch?v=2jHz4F_IBsg,2024-08-08 17:20:56
Alt  Goblet Reverse Lunge (Passada reversa alternada segurando kettlebell),https://www.youtube.com/watch?v=9zimwUDppCw,2024-08-08 17:20:56
Push Up (Flexao de Braco),https://www.youtube.com/watch?v=sobajm4WEvE,2024-08-08 17:20:56
Reverse Lunge to Step Up (Passada reversa e subida na caixa),https://www.youtube.com/watch?v=vhSGqfxVbes,2024-08-08 17:20:56
Front Rack Walking Lunges (Caminhada em passadas com peso no rack frontal),https://www.youtube.com/watch?v=AEwhCQsU6G0,2024-08-08 17:20:56
Over Head Lunges (Passadas com peso sobre a cabeca),https://www.youtube.com/watch?v=W7o8LaNYFDU,2024-08-08 17:20:56
Contralateral Kettlebell Overhead Split Squat (Agachamento afundo com Kettlebell sob a cabeca),https://www.youtube.com/watch?v=9DBYSngZHG4,2024-08-08 17:20:56
Single Arm Rack Tall Kneeling to Standing (Subida de joelhos para posicao em pe com Kettlebell),https://www.youtube.com/watch?v=E4AFBicMw4Y,2024-08-08 17:20:56
Air Squat (Agachamento Livre),https://www.youtube.com/watch?v=WHXPAkDqXUg,2024-08-08 17:20:56
Goblet Squat (Agachamento segurando kettlebell),https://www.youtube.com/watch?v=HOZYjTHE7ug,2024-08-08 17:20:56
Theraband Half Squat Pulses (Semi agachamentos com Miniband),https://www.youtube.com/watch?v=N73x5LjF0vM,2024-08-08 17:20:56
Goblet Squat to Bicep Curl (Agachamento com rosca biceps com Kettlebell),https://www.youtube.com/watch?v=vwA0yYPC17M,2024-08-08 17:20:56
Goblet Wall Sit (Agachamento em isometria na parede segurando kettlebell),https://www.youtube.com/watch?v=aVpTLfCYB-8,2024-08-08 17:20:56
Pause Kettlebell Sumo Jump Squats (Agachamento sumo com saltos com pausa segurando Kettlebell),https://www.youtube.com/watch?v=exICuBvjzZI,2024-08-08 17:20:56
Dual DB Front Squat (Agachamento frontal com dois halteres),https://www.youtube.com/watch?v=ph3O1pkYKX4,2024-08-08 17:20:56
Front Squat (Agachamento com barra a frente),https://www.youtube.com/watch?v=a-0VQxsbmHI,2024-08-08 17:20:56
Back Squat (Agachamento com a barra nas costas),https://www.youtube.com/watch?v=lmsAEw6H2LI,2024-08-08 17:20:56
Calf Raises (Elevacao de calcanhares),https://www.youtube.com/watch?v=pJuG3_5jPn0,2024-08-08 17:20:56
Alt  Dual Ktb Forward Lunges (Avancos alternados com dois kettlebells nos ombros),https://www.youtube.com/watch?v=UrZOaW-HDeg,2024-08-08 17:20:56
Explosive Push Up (Flexao de braco explosiva),https://www.youtube.com/watch?v=u5j9ypmXoIA,2024-08-08 17:20:56
1-1/2 Push Ups (1 Rep +1/2 Flexao de Braco),https://www.youtube.com/watch?v=sZJ33E-xI88,2024-08-08 17:20:56
Alt  DB Bench Press (Supino reto alternado com halteres),https://www.youtube.com/watch?v=HmoR57GFXvo,2024-08-08 17:20:56
DB Bench Press (Supino Reto com Halteres),https://www.youtube.com/watch?v=jVvkWV_h7Es,2024-08-08 17:20:56
Bench Press (Supino Reto),https://www.youtube.com/watch?v=Xgnvm3RkW0o,2024-08-08 17:20:56
Dual DB Shoulder Press (Desenvolvimento militar com dois halteres),https://www.youtube.com/watch?v=G2Q40ydRr-U,2024-08-08 17:20:56
Split Stance Single Kettlebell Press (Desenvolvimento unilateral com base tesoura),https://www.youtube.com/watch?v=BfZ6L7ZTJCI,2024-08-08 17:20:56
Dual Kettlebell Shoulder Press (Desenvolvimento militar com dois Kettlebell),https://www.youtube.com/watch?v=xuvCo8ZY2t8,2024-08-08 17:20:56
Barbell Shoulder Press (Desenvolvimento militar com barra),https://www.youtube.com/watch?v=zOgPnpvzDzg,2024-08-08 17:20:56
Barbell Push Press,https://www.youtube.com/watch?v=0neGRp43hzg,2024-08-08 17:20:56
Triceps Extension (Triceps Testa),https://www.youtube.com/watch?v=YnDWqqhbT-w,2024-08-08 17:20:56
Bench Dips (Triceps Mergulho no banco),https://www.youtube.com/watch?v=xrLdC6qR5jg,2024-08-08 17:20:56
Front Raise (Elevacao Frontal),https://www.youtube.com/watch?v=WzoQC4LEBJ4,2024-08-08 17:20:56
Crunches (Abdominal supra),https://www.youtube.com/watch?v=RcIdCf7CDRE,2024-08-08 17:20:56
Medball Crunches (Abdominal com Medball),https://www.youtube.com/watch?v=lDMz7jvywY8,2024-08-08 17:20:56
Butterfly Crunch (Abdominal borboleta),https://www.youtube.com/watch?v=2jsDOU-K9lU,2024-08-08 17:20:56
Bent Hollow (Abdominal com pernas em 90),https://www.youtube.com/watch?v=TQ6JlgUwdSM,2024-08-08 17:20:56
Bent Hollow Rock (Abdominal em balanco com pernas 90),https://www.youtube.com/watch?v=YQkv6DEj1EQ,2024-08-08 17:20:56
Bent Hundreds Arm Flutter (Movimentacao de bracos nadadeira com pernas 90),https://www.youtube.com/watch?v=3x_P0hAPaf0,2024-08-08 17:20:56
Bent Hollow Flutter Kicks (Movimentacao de pernas estendidas em canoa),https://www.youtube.com/watch?v=i4dndSHrkV0,2024-08-08 17:20:56
Flutter Kicks (Abdominal com batidas de pes),https://www.youtube.com/watch?v=XNDtuXZCXTE,2024-08-08 17:20:56
Cross Body L Crunches (Abdominal com toques cruzados em pernas estendidas),https://www.youtube.com/watch?v=rn77Tq3szhw,2024-08-08 17:20:56
L Crunch (Abdominal com pernas estendidas),https://www.youtube.com/watch?v=mzJ9777mS4A,2024-08-08 17:20:56
Weight L Crunch (Abdominal com pernas estendidas segurando anilha),https://www.youtube.com/watch?v=vuZ3EY4YqKg,2024-08-08 17:20:56
Turkish Sit Up (Subida Turca),https://www.youtube.com/watch?v=R0iosQbxcWs,2024-08-08 17:20:56
Reverse Crunch (Abdominal infra),https://www.youtube.com/watch?v=ZBynmJTnm1s,2024-08-08 17:20:56
Lying Knee to Leg Raise (Abdominal infra com extensao e Flexao de pernas),https://www.youtube.com/watch?v=WP09AdeRy5o,2024-08-08 17:20:56
Dual Leg Raise (Abdominal infra com elevacao de pernas),https://www.youtube.com/watch?v=2aYoQLaOECc,2024-08-08 17:20:56
Figure 4 Leg Lifts (Elevacao de pernas em figura 4),https://www.youtube.com/watch?v=YgA2_RLbzVA,2024-08-08 17:20:56
Alternating Figure 4 Leg Lift (Elevacao de pernas alternadas com figura 4),https://www.youtube.com/watch?v=PLNHOmU_i-E,2024-08-08 17:20:56
Dual Kettlebell Leg Lowering (Abdominal infra com elevacao de pernas mantendo Kettlebell estaticos),https://www.youtube.com/watch?v=GdEavFcrCHw,2024-08-08 17:20:56
Leg Pike Single (Elevacao unilateral de pernas sentado),https://www.youtube.com/watch?v=H-jAWJiTHtc,2024-08-08 17:20:56
Leg Pike (Elevacao de pernas sentado),https://www.youtube.com/watch?v=yFfJcjOZRO8,2024-08-08 17:20:56
Leg Pike Lift Overs (Elevacao de pernas sentado passando por cima de obstaculo),https://www.youtube.com/watch?v=l3_iV6POVHg,2024-08-08 17:20:56
Leg Pike Flutter Kicks (Batidas de pernas sentado),https://www.youtube.com/watch?v=aYLmy8g3GZQ,2024-08-08 17:20:56
Crunches Rotation (Abdominal com rotacao),https://www.youtube.com/watch?v=f1nOAPUXk9A,2024-08-08 17:20:56
Crunches Elbow to Knees (Abdominal cotovelos nos joelhos),https://www.youtube.com/watch?v=OIRCEN02AMY,2024-08-08 17:20:56
Butterfly Cross Knees Touch (Abdominal borboleta com toques cruzados nos joelhos),https://www.youtube.com/watch?v=BIUKrRhQQek,2024-08-08 17:20:56
Oblique Cross Crunches (Abdominal obliquo cruzado),https://www.youtube.com/watch?v=R5M5ioIQXjI,2024-08-08 17:20:56
Bicycle Crunch (Abdominal Bicicleta),https://www.youtube.com/watch?v=JPw4Vv4HayA,2024-08-08 17:20:56
Single Tuck Up (Remador unilateral sem tocar os pes no chao),https://www.youtube.com/watch?v=UXuIWYlFZq0,2024-08-08 17:20:56
Tuck Up (Abdominal Remador sem tocar os pes no chao),https://www.youtube.com/watch?v=IT-ZNo0CPIs,2024-08-08 17:20:56
V Up Diagonal (Canivele uniletaral cruzado com uma perna flexionada e outra estentida),https://www.youtube.com/watch?v=LoR3gWhPnnI,2024-08-08 17:20:56
V Up Alternating (Canivete alternando pernas),https://www.youtube.com/watch?v=JWTbXDDrvS0,2024-08-08 17:20:56
V Up (Abdominal Canivete),https://www.youtube.com/watch?v=cFIpypLFUX0,2024-08-08 17:20:56
V up to V (Abdominal Canivete abrindo as pernas),https://www.youtube.com/watch?v=J-7jwjhg6Gw,2024-08-08 17:20:56
Deadbug,https://www.youtube.com/watch?v=LW2ReC1V8Dw,2024-08-08 17:20:56
Pullover Deadbug,https://www.youtube.com/watch?v=RGF5KwwJ2yE,2024-08-08 17:20:56
Hollow Top Flutter Kicks (Canoa com batidas de pernas no alto),https://www.youtube.com/watch?v=vb6iXbl8pKE,2024-08-08 17:20:56
Hollow Rock (Canoa em balanco),https://www.youtube.com/watch?v=SS2GRVVN3lc,2024-08-08 17:20:56
Hollow Angel (Canoa com movimentacao de anjo),https://www.youtube.com/watch?v=mEvPku9ypy0,2024-08-08 17:20:56
Hollow Flutter Kicks (Canoa com batidas de pernas),https://www.youtube.com/watch?v=RAIZPPN5piI,2024-08-08 17:20:56
Hollow Flutter Siccors (Canoa com movimentacoes de pernas em tesoura),https://www.youtube.com/watch?v=lmEWWE4L1rc,2024-08-08 17:20:56
Weighted Hollow Hold (Canoa em isometria com peso),https://www.youtube.com/watch?v=zQ1p9V0o1Tc,2024-08-08 17:20:56
Pullover Hollow Hold (Pullover em canoa),https://www.youtube.com/watch?v=uXVgrmmVZxY,2024-08-08 17:20:56
Side Crunches (Abdominal Lateral),https://www.youtube.com/watch?v=RKIyeTUau44,2024-08-08 17:20:56
Forearm Side Plank (Prancha baixa lateral),https://www.youtube.com/watch?v=xYAAvnU_Mww,2024-08-08 17:20:56
Side Plank Hip Lift (Prancha lateral com elevacao de quadril),https://www.youtube.com/watch?v=STCfhYTmeZM,2024-08-08 17:20:56
Side Plank Leg Lift (Prancha lateral com elevacao de pernas),https://www.youtube.com/watch?v=3sVRCKxzc78,2024-08-08 17:20:56
Side Plank Rotations (Prancha lateral com rotacao),https://www.youtube.com/watch?v=HZncoaV9gRg,2024-08-08 17:20:56
Side Plank Crunches (Prancha lateral com abdominal),https://www.youtube.com/watch?v=8TYXx1NY4cM,2024-08-08 17:20:56
Side Plank Switches (Pranchas laterais com transicoes),https://www.youtube.com/watch?v=Eq6PccHsfys,2024-08-08 17:20:56
Single Leg Side Plank Hip Taps (Prancha lateral com elevacao de quadril com uma perna de apoio),https://www.youtube.com/watch?v=Ugw38c1ORjs,2024-08-08 17:20:56
Star Plank Rotations (Prancha lateral estrela com rotacao),https://www.youtube.com/watch?v=greiQlJafi8,2024-08-08 17:20:56
Back Extension (Extensao de costas pronado no solo),https://www.youtube.com/watch?v=Ri_8YtjQL0g,2024-08-08 17:20:56
Superman,https://www.youtube.com/watch?v=_E0kibANL0o,2024-08-08 17:20:56
Ark Angel (Movimentacao de anjo em posicao arco pronado),https://www.youtube.com/watch?v=WPF3ZHOp-S8,2024-08-08 17:20:56
Birddog (Perdigueiro),https://www.youtube.com/watch?v=9RafsUcWWVA,2024-08-08 17:20:56
Quadruped Plank (Prancha alta com pernas flexionadas),https://www.youtube.com/watch?v=laFQs2cip2I,2024-08-08 17:20:56
